<?xml version="1.0" encoding="UTF-8"?>
<!--W3C Schema generated by XMLSpy v2008 rel. 2 sp2 (http://www.altova.com)-->
<xs:schema xmlns:xs="http://www.w3.org/2001/XMLSchema">
	<xs:element name="simpleType">
		<xs:complexType mixed="true">
			<xs:choice minOccurs="0">
				<xs:element ref="enumeration" maxOccurs="unbounded"/>
				<xs:element ref="maxLength"/>
			</xs:choice>
			<xs:attribute name="name" use="required">
				<xs:simpleType>
					<xs:restriction base="xs:string">
						<xs:enumeration value="AuthCodeType"/>
						<xs:enumeration value="BuyerAuthStatusEnum"/>
						<xs:enumeration value="CompanyNameType"/>
						<xs:enumeration value="HostCodeType"/>
						<xs:enumeration value="MatchResultEnum"/>
						<xs:enumeration value="OptionalTransType"/>
						<xs:enumeration value="PayPeriodType"/>
						<xs:enumeration value="ProfileIDType"/>
						<xs:enumeration value="RPDateType"/>
						<xs:enumeration value="RPNameType"/>
						<xs:enumeration value="RPRefType"/>
						<xs:enumeration value="RPStatusType"/>
						<xs:enumeration value="StatusType"/>
						<xs:enumeration value="TransactionUpdateActionEnum"/>
						<xs:enumeration value="VerbosityEnum"/>
					</xs:restriction>
				</xs:simpleType>
			</xs:attribute>
			<xs:attribute name="base" use="required">
				<xs:simpleType>
					<xs:restriction base="xs:string">
						<xs:enumeration value="string"/>
					</xs:restriction>
				</xs:simpleType>
			</xs:attribute>
		</xs:complexType>
	</xs:element>
	<xs:element name="sequence">
		<xs:complexType>
			<xs:choice>
				<xs:sequence>
					<xs:element ref="element" maxOccurs="unbounded"/>
					<xs:sequence minOccurs="0">
						<xs:element ref="choice"/>
						<xs:element ref="element" minOccurs="0"/>
					</xs:sequence>
				</xs:sequence>
				<xs:sequence>
					<xs:element ref="choice"/>
					<xs:element ref="element" minOccurs="0" maxOccurs="unbounded"/>
				</xs:sequence>
			</xs:choice>
		</xs:complexType>
	</xs:element>
	<xs:element name="schema">
		<xs:complexType>
			<xs:sequence>
				<xs:element ref="include"/>
				<xs:element ref="element" maxOccurs="unbounded"/>
				<xs:element ref="simpleType"/>
				<xs:element ref="element" maxOccurs="unbounded"/>
				<xs:element ref="simpleType"/>
				<xs:element ref="element" maxOccurs="unbounded"/>
				<xs:element ref="simpleType"/>
				<xs:element ref="element"/>
				<xs:element ref="simpleType" maxOccurs="unbounded"/>
				<xs:element ref="element" maxOccurs="unbounded"/>
				<xs:element ref="simpleType" maxOccurs="unbounded"/>
			</xs:sequence>
			<xs:attribute name="xsd" use="required">
				<xs:simpleType>
					<xs:restriction base="xs:anyURI">
						<xs:enumeration value="http://www.w3.org/2001/XMLSchema"/>
					</xs:restriction>
				</xs:simpleType>
			</xs:attribute>
			<xs:attribute name="targetNamespace" use="required">
				<xs:simpleType>
					<xs:restriction base="xs:anyURI">
						<xs:enumeration value="http://www.paypal.com/XMLPay"/>
					</xs:restriction>
				</xs:simpleType>
			</xs:attribute>
		</xs:complexType>
	</xs:element>
	<xs:element name="maxLength">
		<xs:complexType>
			<xs:attribute name="value" use="required">
				<xs:simpleType>
					<xs:restriction base="xs:short">
						<xs:enumeration value="12"/>
						<xs:enumeration value="127"/>
						<xs:enumeration value="128"/>
						<xs:enumeration value="3"/>
						<xs:enumeration value="6"/>
					</xs:restriction>
				</xs:simpleType>
			</xs:attribute>
		</xs:complexType>
	</xs:element>
	<xs:element name="include">
		<xs:complexType>
			<xs:attribute name="schemaLocation" use="required">
				<xs:simpleType>
					<xs:restriction base="xs:string">
						<xs:enumeration value="XMLPayTypes.xsd"/>
					</xs:restriction>
				</xs:simpleType>
			</xs:attribute>
		</xs:complexType>
	</xs:element>
	<xs:element name="enumeration">
		<xs:complexType>
			<xs:attribute name="value" use="required">
				<xs:simpleType>
					<xs:restriction base="xs:string">
						<xs:enumeration value="A"/>
						<xs:enumeration value="Approve"/>
						<xs:enumeration value="Auth"/>
						<xs:enumeration value="Bi-weekly"/>
						<xs:enumeration value="E"/>
						<xs:enumeration value="Every four weeks"/>
						<xs:enumeration value="F"/>
						<xs:enumeration value="High"/>
						<xs:enumeration value="I"/>
						<xs:enumeration value="Low"/>
						<xs:enumeration value="Match"/>
						<xs:enumeration value="Medium"/>
						<xs:enumeration value="MerchantDecline"/>
						<xs:enumeration value="Monthly"/>
						<xs:enumeration value="N"/>
						<xs:enumeration value="No Match"/>
						<xs:enumeration value="O"/>
						<xs:enumeration value="Off"/>
						<xs:enumeration value="Quarterly"/>
						<xs:enumeration value="Review"/>
						<xs:enumeration value="Sale"/>
						<xs:enumeration value="Semi-monthly"/>
						<xs:enumeration value="Semi-yearly"/>
						<xs:enumeration value="Service Not Available"/>
						<xs:enumeration value="Service Not Requested"/>
						<xs:enumeration value="ServiceDecline"/>
						<xs:enumeration value="U"/>
						<xs:enumeration value="Weekly"/>
						<xs:enumeration value="X"/>
						<xs:enumeration value="Y"/>
						<xs:enumeration value="Yearly"/>
					</xs:restriction>
				</xs:simpleType>
			</xs:attribute>
		</xs:complexType>
	</xs:element>
	<xs:element name="element">
		<xs:complexType>
			<xs:sequence>
				<xs:element ref="complexType" minOccurs="0"/>
			</xs:sequence>
			<xs:attribute name="type">
				<xs:simpleType>
					<xs:restriction base="xs:string">
						<xs:enumeration value="AUActionEnum"/>
						<xs:enumeration value="AUResponseCode"/>
						<xs:enumeration value="AUResponseText"/>
						<xs:enumeration value="AuthCodeType"/>
						<xs:enumeration value="Base64Sha1StringType"/>
						<xs:enumeration value="BuyerAuthMesgType"/>
						<xs:enumeration value="BuyerAuthStatusEnum"/>
						<xs:enumeration value="CommentType"/>
						<xs:enumeration value="CompanyNameType"/>
						<xs:enumeration value="CorrelationIDType"/>
						<xs:enumeration value="CurrencyAmount"/>
						<xs:enumeration value="ECIType"/>
						<xs:enumeration value="ECTokenType"/>
						<xs:enumeration value="EMailType"/>
						<xs:enumeration value="HostCodeType"/>
						<xs:enumeration value="InvNumType"/>
						<xs:enumeration value="MatchResultEnum"/>
						<xs:enumeration value="NameType"/>
						<xs:enumeration value="OptionalTransType"/>
						<xs:enumeration value="PNRefType"/>
						<xs:enumeration value="PPRefType"/>
						<xs:enumeration value="PasswordType"/>
						<xs:enumeration value="PayPeriodType"/>
						<xs:enumeration value="PayerIDType"/>
						<xs:enumeration value="PhoneNumberType"/>
						<xs:enumeration value="ProfileIDType"/>
						<xs:enumeration value="RPDateType"/>
						<xs:enumeration value="RPNameType"/>
						<xs:enumeration value="RPRefType"/>
						<xs:enumeration value="RPStatusType"/>
						<xs:enumeration value="StatusType"/>
						<xs:enumeration value="TenderTypeEnum"/>
						<xs:enumeration value="TransactionUpdateActionEnum"/>
						<xs:enumeration value="UserIdType"/>
						<xs:enumeration value="VerbosityEnum"/>
						<xs:enumeration value="byte"/>
						<xs:enumeration value="date"/>
						<xs:enumeration value="dateTime"/>
						<xs:enumeration value="int"/>
						<xs:enumeration value="string"/>
						<xs:enumeration value="uriReference"/>
					</xs:restriction>
				</xs:simpleType>
			</xs:attribute>
			<xs:attribute name="ref">
				<xs:simpleType>
					<xs:restriction base="xs:string">
						<xs:enumeration value="AVSResult"/>
						<xs:enumeration value="AccountUpdateRequest"/>
						<xs:enumeration value="AccountUpdateResult"/>
						<xs:enumeration value="Add"/>
						<xs:enumeration value="Address"/>
						<xs:enumeration value="Authorization"/>
						<xs:enumeration value="BuyerAuthResult"/>
						<xs:enumeration value="Cancel"/>
						<xs:enumeration value="Capture"/>
						<xs:enumeration value="Credit"/>
						<xs:enumeration value="DoExpressCheckout"/>
						<xs:enumeration value="ExtData"/>
						<xs:enumeration value="ForceCapture"/>
						<xs:enumeration value="FraudPostprocessResult"/>
						<xs:enumeration value="FraudPreprocessResult"/>
						<xs:enumeration value="GetExpressCheckout"/>
						<xs:enumeration value="GetStatus"/>
						<xs:enumeration value="HTTPCommitResult"/>
						<xs:enumeration value="Inquiry"/>
						<xs:enumeration value="Invoice"/>
						<xs:enumeration value="Modify"/>
						<xs:enumeration value="PayData"/>
						<xs:enumeration value="PayDataAuth"/>
						<xs:enumeration value="PayPalResult"/>
						<xs:enumeration value="Payment"/>
						<xs:enumeration value="ProcessorResult"/>
						<xs:enumeration value="RPData"/>
						<xs:enumeration value="RPPaymentResult"/>
						<xs:enumeration value="Reactivate"/>
						<xs:enumeration value="ReceiptData"/>
						<xs:enumeration value="RecurringProfile"/>
						<xs:enumeration value="RecurringProfileResult"/>
						<xs:enumeration value="RepeatSale"/>
						<xs:enumeration value="RequestAuth"/>
						<xs:enumeration value="RequestData"/>
						<xs:enumeration value="ResponseData"/>
						<xs:enumeration value="Sale"/>
						<xs:enumeration value="SetExpressCheckout"/>
						<xs:enumeration value="Signature"/>
						<xs:enumeration value="Tender"/>
						<xs:enumeration value="Transaction"/>
						<xs:enumeration value="TransactionResult"/>
						<xs:enumeration value="TransactionUpdate"/>
						<xs:enumeration value="UserPass"/>
						<xs:enumeration value="ValidateAuthentication"/>
						<xs:enumeration value="VerifyEnrollment"/>
						<xs:enumeration value="VersionIntegrationTracking"/>
						<xs:enumeration value="Void"/>
						<xs:enumeration value="XMLPayReceipt"/>
					</xs:restriction>
				</xs:simpleType>
			</xs:attribute>
			<xs:attribute name="name">
				<xs:simpleType>
					<xs:restriction base="xs:string">
						<xs:enumeration value="ACHStatus"/>
						<xs:enumeration value="ACSUrl"/>
						<xs:enumeration value="AMEXID"/>
						<xs:enumeration value="AUResponseCode"/>
						<xs:enumeration value="AUResponseText"/>
						<xs:enumeration value="AUSubmitDate"/>
						<xs:enumeration value="AVSResult"/>
						<xs:enumeration value="AccountUpdateRequest"/>
						<xs:enumeration value="AccountUpdateRequests"/>
						<xs:enumeration value="AccountUpdateResult"/>
						<xs:enumeration value="AccountUpdateResults"/>
						<xs:enumeration value="Action"/>
						<xs:enumeration value="Add"/>
						<xs:enumeration value="AdditionalMessages"/>
						<xs:enumeration value="AggregateAmt"/>
						<xs:enumeration value="AggregateOptionalTransAmt"/>
						<xs:enumeration value="Amt"/>
						<xs:enumeration value="AuthCode"/>
						<xs:enumeration value="AuthenticationId"/>
						<xs:enumeration value="Authorization"/>
						<xs:enumeration value="BalanceAmount"/>
						<xs:enumeration value="BillTo"/>
						<xs:enumeration value="BrowserCountryCode"/>
						<xs:enumeration value="BrowserTime"/>
						<xs:enumeration value="BrowserUserAgent"/>
						<xs:enumeration value="BuyerAuthResult"/>
						<xs:enumeration value="CAVV"/>
						<xs:enumeration value="CVResult"/>
						<xs:enumeration value="Cancel"/>
						<xs:enumeration value="Capture"/>
						<xs:enumeration value="CardSecure"/>
						<xs:enumeration value="Comment"/>
						<xs:enumeration value="CompanyName"/>
						<xs:enumeration value="CorrelationID"/>
						<xs:enumeration value="Credit"/>
						<xs:enumeration value="Custom"/>
						<xs:enumeration value="DoExpressCheckout"/>
						<xs:enumeration value="ECI"/>
						<xs:enumeration value="EMail"/>
						<xs:enumeration value="End"/>
						<xs:enumeration value="Fax"/>
						<xs:enumeration value="FeeAmount"/>
						<xs:enumeration value="ForceCapture"/>
						<xs:enumeration value="FraudPostprocessResult"/>
						<xs:enumeration value="FraudPreprocessResult"/>
						<xs:enumeration value="GetExpressCheckout"/>
						<xs:enumeration value="GetStatus"/>
						<xs:enumeration value="HTTPCommitResult"/>
						<xs:enumeration value="HTTPCommitResults"/>
						<xs:enumeration value="HostCode"/>
						<xs:enumeration value="HostResponse"/>
						<xs:enumeration value="HostURL"/>
						<xs:enumeration value="IAVSResult"/>
						<xs:enumeration value="Inquiry"/>
						<xs:enumeration value="IntegrationType"/>
						<xs:enumeration value="IntegrationVersion"/>
						<xs:enumeration value="InvNum"/>
						<xs:enumeration value="JavaVersion"/>
						<xs:enumeration value="MaxFailPayments"/>
						<xs:enumeration value="Message"/>
						<xs:enumeration value="Modify"/>
						<xs:enumeration value="Name"/>
						<xs:enumeration value="NextPayment"/>
						<xs:enumeration value="Note"/>
						<xs:enumeration value="NumFailedPayments"/>
						<xs:enumeration value="OSArchitecture"/>
						<xs:enumeration value="OSName"/>
						<xs:enumeration value="OSVersion"/>
						<xs:enumeration value="OptionalTrans"/>
						<xs:enumeration value="OptionalTransAmt"/>
						<xs:enumeration value="OrigMessage"/>
						<xs:enumeration value="OrigPNRef"/>
						<xs:enumeration value="OrigProfileID"/>
						<xs:enumeration value="OrigResult"/>
						<xs:enumeration value="PAReq"/>
						<xs:enumeration value="PARes"/>
						<xs:enumeration value="PNRef"/>
						<xs:enumeration value="PPRef"/>
						<xs:enumeration value="Partner"/>
						<xs:enumeration value="Password"/>
						<xs:enumeration value="PayPalResult"/>
						<xs:enumeration value="PayPeriod"/>
						<xs:enumeration value="PayerID"/>
						<xs:enumeration value="PayerStatus"/>
						<xs:enumeration value="Payment"/>
						<xs:enumeration value="PaymentHistory"/>
						<xs:enumeration value="PaymentNum"/>
						<xs:enumeration value="PaymentType"/>
						<xs:enumeration value="PaymentsLeft"/>
						<xs:enumeration value="PendingReason"/>
						<xs:enumeration value="Phone"/>
						<xs:enumeration value="ProcessorResult"/>
						<xs:enumeration value="ProfileID"/>
						<xs:enumeration value="Proxy"/>
						<xs:enumeration value="RMSID"/>
						<xs:enumeration value="RPData"/>
						<xs:enumeration value="RPPaymentResult"/>
						<xs:enumeration value="RPRef"/>
						<xs:enumeration value="RRN"/>
						<xs:enumeration value="Reactivate"/>
						<xs:enumeration value="ReceiptData"/>
						<xs:enumeration value="ReceiptURL"/>
						<xs:enumeration value="RecurringProfile"/>
						<xs:enumeration value="RecurringProfileResult"/>
						<xs:enumeration value="RecurringProfileResults"/>
						<xs:enumeration value="RecurringProfiles"/>
						<xs:enumeration value="RepeatSale"/>
						<xs:enumeration value="RequestAuth"/>
						<xs:enumeration value="RequestData"/>
						<xs:enumeration value="ResponseData"/>
						<xs:enumeration value="ResponseText"/>
						<xs:enumeration value="Result"/>
						<xs:enumeration value="RetryNumDays"/>
						<xs:enumeration value="STAN"/>
						<xs:enumeration value="Sale"/>
						<xs:enumeration value="SetExpressCheckout"/>
						<xs:enumeration value="SettleDate"/>
						<xs:enumeration value="ShipTo"/>
						<xs:enumeration value="Start"/>
						<xs:enumeration value="Status"/>
						<xs:enumeration value="StreetMatch"/>
						<xs:enumeration value="Tender"/>
						<xs:enumeration value="Term"/>
						<xs:enumeration value="Token"/>
						<xs:enumeration value="TotalAmt"/>
						<xs:enumeration value="TrStatus"/>
						<xs:enumeration value="TransState"/>
						<xs:enumeration value="TransTime"/>
						<xs:enumeration value="Transaction"/>
						<xs:enumeration value="TransactionReceipts"/>
						<xs:enumeration value="TransactionResult"/>
						<xs:enumeration value="TransactionResults"/>
						<xs:enumeration value="TransactionUpdate"/>
						<xs:enumeration value="Transactions"/>
						<xs:enumeration value="User"/>
						<xs:enumeration value="UserDomain"/>
						<xs:enumeration value="UserPass"/>
						<xs:enumeration value="ValidateAuthentication"/>
						<xs:enumeration value="Vendor"/>
						<xs:enumeration value="Verbosity"/>
						<xs:enumeration value="VerifyEnrollment"/>
						<xs:enumeration value="VersionIntegrationTracking"/>
						<xs:enumeration value="Void"/>
						<xs:enumeration value="WrapperType"/>
						<xs:enumeration value="WrapperVersion"/>
						<xs:enumeration value="XID"/>
						<xs:enumeration value="XMLData"/>
						<xs:enumeration value="XMLPayReceipt"/>
						<xs:enumeration value="XMLPayRequest"/>
						<xs:enumeration value="XMLPayResponse"/>
						<xs:enumeration value="ZipMatch"/>
					</xs:restriction>
				</xs:simpleType>
			</xs:attribute>
			<xs:attribute name="minOccurs">
				<xs:simpleType>
					<xs:restriction base="xs:byte">
						<xs:enumeration value="0"/>
						<xs:enumeration value="1"/>
					</xs:restriction>
				</xs:simpleType>
			</xs:attribute>
			<xs:attribute name="maxOccurs">
				<xs:simpleType>
					<xs:restriction base="xs:string">
						<xs:enumeration value="1"/>
						<xs:enumeration value="unbounded"/>
					</xs:restriction>
				</xs:simpleType>
			</xs:attribute>
		</xs:complexType>
	</xs:element>
	<xs:element name="complexType">
		<xs:complexType>
			<xs:choice>
				<xs:element ref="choice"/>
				<xs:element ref="element" maxOccurs="unbounded"/>
				<xs:sequence>
					<xs:element ref="sequence"/>
					<xs:sequence minOccurs="0">
						<xs:element ref="attribute" maxOccurs="unbounded"/>
						<xs:element ref="element" minOccurs="0" maxOccurs="unbounded"/>
					</xs:sequence>
				</xs:sequence>
			</xs:choice>
			<xs:attribute name="content" use="required">
				<xs:simpleType>
					<xs:restriction base="xs:string">
						<xs:enumeration value="elementOnly"/>
					</xs:restriction>
				</xs:simpleType>
			</xs:attribute>
		</xs:complexType>
	</xs:element>
	<xs:element name="choice">
		<xs:complexType>
			<xs:sequence>
				<xs:element ref="element" maxOccurs="unbounded"/>
			</xs:sequence>
		</xs:complexType>
	</xs:element>
	<xs:element name="attribute">
		<xs:complexType>
			<xs:attribute name="type" use="required">
				<xs:simpleType>
					<xs:restriction base="xs:string">
						<xs:enumeration value="ID"/>
						<xs:enumeration value="ReferenceIdType"/>
						<xs:enumeration value="boolean"/>
						<xs:enumeration value="int"/>
						<xs:enumeration value="string"/>
					</xs:restriction>
				</xs:simpleType>
			</xs:attribute>
			<xs:attribute name="name" use="required">
				<xs:simpleType>
					<xs:restriction base="xs:string">
						<xs:enumeration value="CustRef"/>
						<xs:enumeration value="Duplicate"/>
						<xs:enumeration value="Id"/>
						<xs:enumeration value="Timeout"/>
						<xs:enumeration value="request_id"/>
						<xs:enumeration value="response_id"/>
						<xs:enumeration value="version"/>
						<xs:enumeration value="xmlns"/>
					</xs:restriction>
				</xs:simpleType>
			</xs:attribute>
		</xs:complexType>
	</xs:element>
</xs:schema>
