<?xml version="1.0" encoding="UTF-8"?>
<schema targetNamespace="http://www.paypal.com/XMLPay"xsd="" xmlns:xsi="http://www.w3.org/2001/XMLSchema-instance" xsi:noNamespaceSchemaLocation="XMLPay_2001.xsd">
	<include schemaLocation="XMLPayTypes_2001.xsd"/>
	<element name="XMLPayRequest">
		<complexType content="elementOnly">
			<sequence>
				<element ref="RequestData"/>
				<element ref="RequestAuth"/>
			</sequence>
			<attribute name="version" type="string"/>
			<attribute name="request_id" type="string"/>
			<attribute name="response_id" type="string"/>
			<attribute name="Timeout" type="int"/>
		</complexType>
	</element>
	<element name="VersionIntegrationTracking">
		<complexType content="elementOnly">
			<sequence>
				<element name="IntegrationType" type="string" minOccurs="0" maxOccurs="1"/>
				<element name="IntegrationVersion" type="string" minOccurs="0" maxOccurs="1"/>
				<element name="WrapperType" type="string" minOccurs="0" maxOccurs="1"/>
				<element name="WrapperVersion" type="string" minOccurs="0" maxOccurs="1"/>
				<element name="OSName" type="string" minOccurs="0" maxOccurs="1"/>
				<element name="OSArchitecture" type="string" minOccurs="0" maxOccurs="1"/>
				<element name="OSVersion" type="string" minOccurs="0" maxOccurs="1"/>
				<element name="JavaVersion" type="string" minOccurs="0" maxOccurs="1"/>
				<element name="Proxy" type="string" minOccurs="0" maxOccurs="1"/>
				<element ref="ExtData" minOccurs="0" maxOccurs="unbounded"/>
			</sequence>
		</complexType>
	</element>
	<element name="RequestData">
		<complexType content="elementOnly">
			<sequence>
				<element name="Vendor" type="UserIdType"/>
				<element name="Partner" type="UserIdType"/>
				<choice>
					<element name="Transactions">
						<complexType content="elementOnly">
							<element ref="Transaction" minOccurs="1" maxOccurs="unbounded"/>
						</complexType>
					</element>
					<element name="RecurringProfiles">
						<complexType content="elementOnly">
							<element ref="RecurringProfile" minOccurs="1" maxOccurs="unbounded"/>
						</complexType>
					</element>
					<element name="AccountUpdateRequests">
						<complexType content="elementOnly">
							<element ref="AccountUpdateRequest" minOccurs="1" maxOccurs="unbounded"/>
						</complexType>
					</element>
				</choice>
				<element ref="VersionIntegrationTracking" minOccurs="0" maxOccurs="1"/>
			</sequence>
		</complexType>
	</element>
	<element name="RequestAuth">
		<complexType content="elementOnly">
			<choice>
				<element ref="UserPass"/>
				<element ref="Signature"/>
			</choice>
		</complexType>
	</element>
	<element name="XMLPayResponse">
		<complexType content="elementOnly">
			<sequence>
				<element ref="ResponseData"/>
				<element ref="Signature" minOccurs="0" maxOccurs="1"/>
				<element name="TransactionReceipts" minOccurs="0" maxOccurs="1">
					<complexType content="elementOnly">
						<element ref="XMLPayReceipt" minOccurs="1" maxOccurs="unbounded"/>
					</complexType>
				</element>
			</sequence>
			<attribute name="xmlns" type="string"/>
			<attribute name="version" type="string"/>
			<attribute name="request_id" type="string"/>
			<attribute name="response_id" type="string"/>
		</complexType>
	</element>
	<element name="ResponseData">
		<complexType content="elementOnly">
			<sequence>
				<element name="Vendor" type="UserIdType"/>
				<element name="Partner" type="UserIdType"/>
				<choice>
					<element name="TransactionResults">
						<complexType content="elementOnly">
							<element ref="TransactionResult" minOccurs="1" maxOccurs="unbounded"/>
						</complexType>
					</element>
					<element name="RecurringProfileResults">
						<complexType content="elementOnly">
							<element ref="RecurringProfileResult" minOccurs="1" maxOccurs="unbounded"/>
						</complexType>
					</element>
					<element name="AccountUpdateResults">
						<complexType content="elementOnly">
							<element ref="AccountUpdateResult" minOccurs="1" maxOccurs="unbounded"/>
						</complexType>
					</element>
					<element name="HTTPCommitResults">
						<complexType content="elementOnly">
							<element ref="HTTPCommitResult" minOccurs="1" maxOccurs="unbounded"/>
						</complexType>
					</element>
				</choice>
			</sequence>
		</complexType>
	</element>
	<element name="XMLPayReceipt">
		<complexType content="elementOnly">
			<sequence>
				<element ref="ReceiptData"/>
				<element ref="Signature" minOccurs="0" maxOccurs="1"/>
			</sequence>
		</complexType>
	</element>
	<element name="ReceiptData">
		<complexType content="elementOnly">
			<sequence>
				<element name="Vendor" type="UserIdType"/>
				<element name="Partner" type="UserIdType"/>
				<element ref="Transaction"/>
				<element ref="TransactionResult"/>
			</sequence>
		</complexType>
	</element>
	<element name="Transaction">
		<complexType content="elementOnly">
			<sequence>
				<choice>
					<element ref="Authorization"/>
					<element ref="Capture"/>
					<element ref="Sale"/>
					<element ref="Credit"/>
					<element ref="Void"/>
					<element ref="ForceCapture"/>
					<element ref="RepeatSale"/>
					<element ref="GetStatus"/>
					<element ref="VerifyEnrollment"/>
					<element ref="ValidateAuthentication"/>
					<element ref="TransactionUpdate"/>
					<element ref="SetExpressCheckout"/>
					<element ref="GetExpressCheckout"/>
					<element ref="DoExpressCheckout"/>
				</choice>
			</sequence>
			<attribute name="Id" type="ID"/>
			<attribute name="CustRef" type="ReferenceIdType"/>
			<element name="Verbosity" type="VerbosityEnum" minOccurs="0" maxOccurs="1"/>
			<element name="BrowserUserAgent" type="string" minOccurs="0" maxOccurs="1"/>
			<element name="BrowserTime" type="string" minOccurs="0" maxOccurs="1"/>
			<element name="BrowserCountryCode" type="string" minOccurs="0" maxOccurs="1"/>
		</complexType>
	</element>
	<simpleType name="VerbosityEnum" base="string">
		<enumeration value="Off"/>
		<enumeration value="Low"/>
		<enumeration value="Medium"/>
		<enumeration value="High"/>
	</simpleType>
	<element name="Authorization">
		<complexType content="elementOnly">
			<sequence>
				<element ref="PayData"/>
				<element ref="PayDataAuth" minOccurs="0" maxOccurs="1"/>
				<element ref="ExtData" minOccurs="0" maxOccurs="unbounded"/>
			</sequence>
		</complexType>
	</element>
	<element name="Capture">
		<complexType content="elementOnly">
			<sequence>
				<choice>
					<element name="PNRef" type="PNRefType"/>
					<element name="PPRef" type="PPRefType"/>
				</choice>
				<element ref="Invoice" minOccurs="0" maxOccurs="1"/>
				<element ref="ExtData" minOccurs="0" maxOccurs="unbounded"/>
			</sequence>
		</complexType>
	</element>
	<element name="Sale">
		<complexType content="elementOnly">
			<sequence>
				<element ref="PayData"/>
				<element ref="PayDataAuth" minOccurs="0" maxOccurs="1"/>
				<element ref="ExtData" minOccurs="0" maxOccurs="unbounded"/>
			</sequence>
		</complexType>
	</element>
	<element name="Credit">
		<complexType content="elementOnly">
			<sequence>
				<choice>
					<element name="PNRef" type="PNRefType"/>
					<element name="PPRef" type="PPRefType"/>
					<element ref="Tender"/>
				</choice>
				<element ref="Invoice" minOccurs="0" maxOccurs="1"/>
				<element ref="ExtData" minOccurs="0" maxOccurs="unbounded"/>
			</sequence>
		</complexType>
	</element>
	<element name="Void">
		<complexType content="elementOnly">
			<sequence>
				<choice>
					<element name="PNRef" type="PNRefType"/>
					<element name="PPRef" type="PPRefType"/>
				</choice>
				<element name="Note" type="string" minOccurs="0" maxOccurs="1"/>
				<element ref="ExtData" minOccurs="0" maxOccurs="unbounded"/>
			</sequence>
		</complexType>
	</element>
	<element name="ForceCapture">
		<complexType content="elementOnly">
			<sequence>
				<element ref="PayData"/>
				<element ref="PayDataAuth" minOccurs="0" maxOccurs="1"/>
				<element name="AuthCode" type="AuthCodeType"/>
				<element ref="ExtData" minOccurs="0" maxOccurs="unbounded"/>
			</sequence>
		</complexType>
	</element>
	<element name="RepeatSale">
		<complexType content="elementOnly">
			<sequence>
				<element name="PNRef" type="PNRefType"/>
				<element ref="Invoice" minOccurs="0" maxOccurs="1"/>
				<element ref="ExtData" minOccurs="0" maxOccurs="unbounded"/>
			</sequence>
		</complexType>
	</element>
	<element name="GetStatus">
		<complexType content="elementOnly">
			<sequence>
				<element name="PNRef" type="PNRefType"/>
				<element ref="ExtData" minOccurs="0" maxOccurs="unbounded"/>
			</sequence>
		</complexType>
	</element>
	<element name="VerifyEnrollment">
		<complexType content="elementOnly">
			<sequence>
				<element ref="PayData"/>
				<element ref="ExtData" minOccurs="0" maxOccurs="unbounded"/>
			</sequence>
		</complexType>
	</element>
	<element name="ValidateAuthentication">
		<complexType content="elementOnly">
			<sequence>
				<element name="PARes" type="BuyerAuthMesgType"/>
				<element ref="ExtData" minOccurs="0" maxOccurs="unbounded"/>
			</sequence>
		</complexType>
	</element>
	<element name="AccountUpdateRequest">
		<complexType content="elementOnly">
			<sequence>
				<element name="Action" type="AUActionEnum"/>
				<choice>
					<element name="PNRef" type="PNRefType"/>
					<element ref="Tender"/>
				</choice>
				<element ref="ExtData" minOccurs="0" maxOccurs="unbounded"/>
			</sequence>
		</complexType>
	</element>
	<simpleType name="TransactionUpdateActionEnum" base="string">
		<enumeration value="Approve"/>
		<enumeration value="Review"/>
		<enumeration value="ServiceDecline"/>
		<enumeration value="MerchantDecline"/>
	</simpleType>
	<element name="TransactionUpdate">